{
  "grade": 1,
  "series": "あかねこ漢字スキル",
  "publisher": "光村教育図書",
  "textbook": "光村図書 令和2年度版",
  "totalKanji": 80,
  "books": [
    {
      "book": "上",
      "lessons": [
        {
          "number": 1,
          "title": "けんかした 山(1)",
          "kanji": [
            "一",
            "二",
            "三"
          ]
        },
        {
          "number": 2,
          "title": "けんかした 山(2)",
          "kanji": [
            "木",
            "火",
            "山",
            "日",
            "月"
          ]
        },
        {
          "number": 3,
          "title": "かん字の はじまり(1)",
          "kanji": [
            "人",
            "川",
            "上",
            "下",
            "字"
          ]
        },
        {
          "number": 4,
          "title": "かん字の はじまり(2) / だれが、たべたのでしょう / たのしかった ことを かこう",
          "kanji": [
            "四",
            "五",
            "田",
            "口",
            "子"
          ]
        },
        {
          "number": 5,
          "title": "かぞえよう(1) / かぞえよう(2)",
          "kanji": [
            "九",
            "十",
            "六",
            "七",
            "八"
          ]
        },
        {
          "number": 6,
          "title": "しらせたいな、いきものの ひみつ / はたらく じどう車(1)",
          "kanji": [
            "車",
            "手",
            "白",
            "文",
            "見"
          ]
        },
        {
          "number": 7,
          "title": "はたらく じどう車(2) / 「のりものカード」で しらせよう",
          "kanji": [
            "名",
            "出",
            "水",
            "土",
            "大"
          ]
        },
        {
          "number": 8,
          "title": "なにを しているのかな？ / 日づけと よう日",
          "kanji": [
            "花",
            "虫",
            "正",
            "早",
            "金"
          ]
        },
        {
          "number": 9,
          "title": "うみの ながい たび(1)",
          "kanji": [
            "耳",
            "空",
            "青",
            "目",
            "百"
          ]
        },
        {
          "number": 10,
          "title": "うみの ながい たび(2)",
          "kanji": [
            "年",
            "立",
            "音",
            "力",
            "千"
          ]
        },
        {
          "number": 11,
          "title": "天に のぼった おけやさん / かたかな / かん字の よみかた(1)",
          "kanji": [
            "本",
            "天",
            "気",
            "中",
            "小"
          ]
        },
        {
          "number": 12,
          "title": "かん字の よみかた(2)",
          "kanji": [
            "先",
            "生",
            "糸",
            "竹",
            "右",
            "左"
          ]
        },
        {
          "number": 13,
          "title": "こころが あたたかく なる 手がみ / スイミー",
          "kanji": [
            "雨",
            "赤",
            "休",
            "林",
            "夕"
          ]
        }
      ]
    },
    {
      "book": "下",
      "lessons": [
        {
          "number": 1,
          "title": "文をつくろう / かわる よみかた(1)",
          "kanji": [
            "学",
            "校",
            "男",
            "女",
            "円",
            "草"
          ]
        },
        {
          "number": 2,
          "title": "ことばで つたえよう / かわる よみかた(2) / にて いる かん字(1)",
          "kanji": [
            "石",
            "玉",
            "村",
            "入",
            "犬"
          ]
        },
        {
          "number": 3,
          "title": "にて いる かん字(2)",
          "kanji": [
            "貝",
            "足",
            "王",
            "町",
            "森"
          ]
        }
      ]
    }
  ]
}