{
  "grade": 4,
  "series": "あかねこ漢字スキル",
  "publisher": "光村教育図書",
  "textbook": "光村図書 令和2年度版",
  "totalKanji": 202,
  "books": [
    {
      "book": "1学期",
      "lessons": [
        {
          "number": 1,
          "title": "白いぼうし",
          "kanji": ["信", "初", "達", "変", "席", "菜", "笑", "香", "梅"]
        },
        {
          "number": 2,
          "title": "見つけよう、ぴったりの言葉 / 漢字の部首(1)",
          "kanji": ["周", "順", "関", "印", "浴", "加", "努", "芽", "完", "富"]
        },
        {
          "number": 3,
          "title": "漢字の部首(2) / そうの重さを量る / 花を見つける手がかり(1)",
          "kanji": ["英", "量", "法", "最", "約", "験", "観", "察", "種", "類"]
        },
        {
          "number": 4,
          "title": "花を見つける手がかり(2) / 分類をもとに本を見つけよう / 漢字辞典の使い方(1)",
          "kanji": ["別", "念", "単", "位", "照", "然", "産", "芸", "辞", "典"]
        },
        {
          "number": 5,
          "title": "漢字辞典の使い方(2)",
          "kanji": ["治", "成", "訓", "径", "兆", "臣", "城", "奈", "塩", "省"]
        },
        {
          "number": 6,
          "title": "漢字辞典の使い方(3) / メモの取り方のくふう / リーフレットでほうこく(1)",
          "kanji": ["刷", "良", "孫", "愛", "必", "要", "伝", "課", "害", "機"]
        },
        {
          "number": 7,
          "title": "リーフレットでほうこく(2) / 短歌の世界 / 漢字の音を表す部分(1)",
          "kanji": ["械", "折", "説", "参", "衣", "景", "辺", "以", "飯", "案"]
        },
        {
          "number": 8,
          "title": "漢字の音を表す部分(2)",
          "kanji": ["児", "貨", "未", "満", "令", "冷", "静", "官", "束", "各"]
        },
        {
          "number": 9,
          "title": "都道府県名に用いる漢字(1)",
          "kanji": ["府", "茨", "栃", "群", "埼", "潟", "井", "梨", "岐", "阜"]
        },
        {
          "number": 10,
          "title": "都道府県名に用いる漢字(2)",
          "kanji": ["岡", "滋", "賀", "阪", "兵", "徳", "媛", "佐", "崎", "熊"]
        },
        {
          "number": 11,
          "title": "都道府県名に用いる漢字(3) / 落語 ぞろぞろ",
          "kanji": ["鹿", "沖", "縄", "末", "結", "置", "残", "失", "借"]
        }
      ]
    },
    {
      "book": "2学期",
      "lessons": [
        {
          "number": 1,
          "title": "写真から読み取る / 作ろう学級新聞",
          "kanji": ["季", "節", "果", "的", "給", "栄", "養"]
        },
        {
          "number": 2,
          "title": "送りがなのつけ方",
          "kanji": ["老", "固", "働", "希", "望", "唱", "挙", "覚"]
        },
        {
          "number": 3,
          "title": "一つの花(1)",
          "kanji": ["戦", "争", "飛", "焼", "包", "帯", "泣", "勇", "軍", "隊"]
        },
        {
          "number": 4,
          "title": "一つの花(2) / 修飾語 / 作ろう！「ショートショート」 / 「月」のつく言葉",
          "kanji": ["輪", "旗", "牧", "不", "議", "博", "欠"]
        },
        {
          "number": 5,
          "title": "ごんぎつね / 「読書発表会」をしよう",
          "kanji": ["散", "続", "松", "側", "巣", "連", "録", "料", "陸", "極"]
        },
        {
          "number": 6,
          "title": "みんなが楽しめる新スポーツ / いろいろな意味を表す漢字(1)",
          "kanji": ["仲", "司", "願", "共", "試", "協", "選", "灯", "民"]
        },
        {
          "number": 7,
          "title": "いろいろな意味を表す漢字(2) / ウミガメの命をつなぐ",
          "kanji": ["副", "夫", "札", "材", "億", "無", "管", "功", "漁"]
        },
        {
          "number": 8,
          "title": "二つのことがらをつなぐ言葉 / クラスの「不思議ずかん」を作ろう / 故事成語",
          "kanji": ["例", "昨", "街", "徒", "特", "利", "労", "器"]
        }
      ]
    },
    {
      "book": "3学期",
      "lessons": [
        {
          "number": 1,
          "title": "熟語のでき方 / くらしを便利にするために",
          "kanji": ["祝", "清", "低", "便", "付", "改", "差", "票", "郡"]
        },
        {
          "number": 2,
          "title": "点（、）を打つところ / 自分の成長をふり返って / 雪",
          "kanji": ["積", "候", "健", "康", "敗", "好", "浅", "氏", "標"]
        },
        {
          "number": 3,
          "title": "同じ読み方の漢字の使い分け / 人形げき 木竜うるし",
          "kanji": ["卒", "求", "底", "鏡", "倉", "競", "熱", "建"]
        }
      ]
    }
  ]
}
