{
  "grade": 6,
  "series": "あかねこ漢字スキル",
  "publisher": "光村教育図書",
  "textbook": "光村図書 令和2年度版",
  "totalKanji": 191,
  "books": [
    {
      "book": "1学期",
      "lessons": [
        {
          "number": 1,
          "title": "あの坂をのぼれば / 春はあけぼの(1)",
          "kanji": ["背", "筋", "幼", "裏", "奮", "磁", "降", "暮", "灰"]
        },
        {
          "number": 2,
          "title": "春はあけぼの(2) / 主語と述語の対応をかくにんしよう / 三字以上の熟語の構成(1)",
          "kanji": ["暖", "私", "将", "熟", "並", "諸", "貴", "棒", "奏", "賃"]
        },
        {
          "number": 3,
          "title": "三字以上の熟語の構成(2)",
          "kanji": ["層", "己", "退", "郵", "遺", "処", "蒸", "策", "乱", "模"]
        },
        {
          "number": 4,
          "title": "三字以上の熟語の構成(3) / アイスは暑いほどおいしい？――グラフの読み取り / 雪は新しいエネルギー――未来へつなぐエネルギー社会(1)",
          "kanji": ["券", "縦", "異", "危", "存", "除", "蔵", "糖", "域", "呼"]
        },
        {
          "number": 5,
          "title": "雪は新しいエネルギー――未来へつなぐエネルギー社会(2)",
          "kanji": ["脳", "割", "捨", "拡", "宣", "郷", "補", "皇", "陛", "后"]
        },
        {
          "number": 6,
          "title": "雪は新しいエネルギー――未来へつなぐエネルギー社会(3)",
          "kanji": ["党", "純", "権", "孝", "厳", "傷"]
        },
        {
          "number": 7,
          "title": "パネルディスカッション――地域の防災 / 雨 / 複数の意味をもつ漢字(1)",
          "kanji": ["論", "討", "難", "簡", "俳", "垂", "源", "姿", "針", "樹"]
        },
        {
          "number": 8,
          "title": "複数の意味をもつ漢字(2)",
          "kanji": ["預", "警", "署", "勤", "我", "操", "裁", "臨"]
        },
        {
          "number": 9,
          "title": "川とノリオ(1)",
          "kanji": ["若", "洗", "映", "片", "巻", "砂", "穴", "探", "晩", "干"]
        },
        {
          "number": 10,
          "title": "川とノリオ(2) / 地域の施設を活用しよう",
          "kanji": ["穀", "至", "恩", "舌", "射", "座", "欲", "届", "訪"]
        }
      ]
    },
    {
      "book": "2学期",
      "lessons": [
        {
          "number": 1,
          "title": "聞かせて！「とっておき」の話 / 「知恵の言葉」を集めよう / あなたは作家",
          "kanji": ["班", "痛", "装", "視", "宇", "宙"]
        },
        {
          "number": 2,
          "title": "なぜ、わかり合えなかったのかな？ / 熟語の使い分け",
          "kanji": ["誤", "収", "冊", "推", "段"]
        },
        {
          "number": 3,
          "title": "きつねの窓(1)",
          "kanji": ["窓", "染", "看", "胸", "派", "敵", "腹", "激", "銭", "困"]
        },
        {
          "number": 4,
          "title": "きつねの窓(2)",
          "kanji": ["忘", "絹", "俵", "株", "骨", "蚕", "沿", "宅"]
        },
        {
          "number": 5,
          "title": "十二歳の主張 / 音を表す部分(1)",
          "kanji": ["疑", "善", "専", "閣", "縮", "頂", "庁", "枚", "泉"]
        },
        {
          "number": 6,
          "title": "音を表す部分(2)",
          "kanji": ["批", "詞", "誌", "創", "忠", "誠", "延", "済"]
        },
        {
          "number": 7,
          "title": "あなたはどう感じる？ / ぼくの世界、君の世界(1)",
          "kanji": ["紅", "盛", "秘", "密", "展", "否", "亡", "宗", "系"]
        },
        {
          "number": 8,
          "title": "ぼくの世界、君の世界(2) / 「うれしさ」って何？――哲学対話をつづけよう",
          "kanji": ["仁", "聖", "尺", "肺", "臓", "律", "衆", "胃", "腸", "誕"]
        },
        {
          "number": 9,
          "title": "その場にふさわしい言い方 / 「迷う」 / 六年生の思い出をつづろう――卒業文集",
          "kanji": ["敬", "担", "閉", "承", "拝", "尊", "刻", "優", "吸"]
        }
      ]
    },
    {
      "book": "3学期",
      "lessons": [
        {
          "number": 1,
          "title": "同じ訓をもつ漢字(1)",
          "kanji": ["就", "値", "憲", "納", "盟", "革", "揮", "卵", "寸", "鋼"]
        },
        {
          "number": 2,
          "title": "同じ訓をもつ漢字(2) / 津田梅子――未来をきりひらく「人」への思い / 日本語の文字",
          "kanji": ["供", "幕", "訳", "机", "翌", "認", "潮", "障", "宝", "著"]
        },
        {
          "number": 3,
          "title": "さまざまな読み方",
          "kanji": ["従", "劇", "乳", "朗", "覧"]
        }
      ]
    }
  ]
}
