{
  "grade": 3,
  "series": "あかねこ漢字スキル",
  "publisher": "光村教育図書",
  "textbook": "光村図書 令和2年度版",
  "totalKanji": 200,
  "books": [
    {
      "book": "1学期",
      "lessons": [
        {
          "number": 1,
          "title": "白い花びら(1)",
          "kanji": [
            "物",
            "開",
            "返",
            "事",
            "登",
            "乗",
            "主",
            "動"
          ]
        },
        {
          "number": 2,
          "title": "白い花びら(2) / 「発見ノート」",
          "kanji": [
            "岸",
            "橋",
            "発",
            "表",
            "調",
            "予",
            "想",
            "葉",
            "温",
            "由"
          ]
        },
        {
          "number": 3,
          "title": "わたしのたからもの / 国語辞典のつかい方",
          "kanji": [
            "漢",
            "意",
            "味",
            "号",
            "重",
            "問",
            "練",
            "習"
          ]
        },
        {
          "number": 4,
          "title": "うめぼしのはたらき / 漢字学習ノート / めだか(1)",
          "kanji": [
            "運",
            "感",
            "転",
            "集",
            "実",
            "消",
            "化",
            "面",
            "泳"
          ]
        },
        {
          "number": 5,
          "title": "めだか(2)",
          "kanji": [
            "身",
            "守",
            "第",
            "次",
            "死",
            "度",
            "流",
            "研",
            "究",
            "秒"
          ]
        },
        {
          "number": 6,
          "title": "めだか(3) / 本をさがそう / クラスの「生き物ブック」",
          "kanji": [
            "全",
            "題",
            "和",
            "昭",
            "皮",
            "相",
            "章",
            "館"
          ]
        },
        {
          "number": 7,
          "title": "漢字の音と訓 / 紙ひこうき、きみへ(1)",
          "kanji": [
            "庭",
            "命",
            "炭",
            "品",
            "平",
            "皿",
            "等",
            "代",
            "着",
            "客"
          ]
        },
        {
          "number": 8,
          "title": "紙ひこうき、きみへ(2)",
          "kanji": [
            "待",
            "持",
            "具",
            "取",
            "旅",
            "様",
            "悲",
            "部",
            "屋"
          ]
        }
      ]
    },
    {
      "book": "2学期",
      "lessons": [
        {
          "number": 1,
          "title": "「りす公園」はどこにある？ / 取材したことをほうこく文に(1)",
          "kanji": [
            "写",
            "真",
            "礼",
            "安",
            "遊",
            "駅",
            "曲",
            "仕"
          ]
        },
        {
          "number": 2,
          "title": "取材したことをほうこく文に(2) / 自分の気持ちを手紙に",
          "kanji": [
            "商",
            "員",
            "区",
            "申",
            "送",
            "所",
            "丁",
            "住"
          ]
        },
        {
          "number": 3,
          "title": "送りがな",
          "kanji": [
            "苦",
            "暗",
            "洋",
            "服",
            "育",
            "打",
            "飲",
            "負",
            "暑",
            "薬"
          ]
        },
        {
          "number": 4,
          "title": "わすれられないおくりもの",
          "kanji": [
            "助",
            "向",
            "幸",
            "終",
            "速",
            "者",
            "寒",
            "央"
          ]
        },
        {
          "number": 5,
          "title": "俳句に親しむ / きせつの言葉を集めよう",
          "kanji": [
            "陽",
            "氷",
            "有",
            "植",
            "緑",
            "祭",
            "湯",
            "豆",
            "式"
          ]
        },
        {
          "number": 6,
          "title": "世界の人につたわるように / くらしと絵文字(1)",
          "kanji": [
            "世",
            "界",
            "注",
            "進",
            "指",
            "役",
            "港",
            "箱",
            "深"
          ]
        },
        {
          "number": 7,
          "title": "くらしと絵文字(2) / わたしたちの絵文字 / 気持ちをつたえる話し方・聞き方",
          "kanji": [
            "病",
            "院",
            "都",
            "反",
            "対",
            "整",
            "受",
            "級",
            "横"
          ]
        },
        {
          "number": 8,
          "title": "へんとつくり",
          "kanji": [
            "童",
            "談",
            "柱",
            "業",
            "倍",
            "投",
            "球",
            "宿",
            "勉",
            "放"
          ]
        },
        {
          "number": 9,
          "title": "モチモチの木(1)",
          "kanji": [
            "起",
            "神",
            "歯",
            "両",
            "追",
            "落",
            "鼻"
          ]
        },
        {
          "number": 10,
          "title": "モチモチの木(2) / 「おすすめ図書カード」を作ろう",
          "kanji": [
            "医",
            "坂",
            "血",
            "他",
            "銀",
            "油",
            "係"
          ]
        },
        {
          "number": 11,
          "title": "こそあど言葉 / はっとしたことを詩に / ことわざ・慣用句",
          "kanji": [
            "農",
            "湖",
            "美",
            "詩",
            "短",
            "昔",
            "筆",
            "急",
            "根"
          ]
        }
      ]
    },
    {
      "book": "3学期",
      "lessons": [
        {
          "number": 1,
          "title": "ちいきの行事 / 文の組み立て",
          "kanji": [
            "決",
            "使",
            "委",
            "始",
            "帳",
            "列",
            "局"
          ]
        },
        {
          "number": 2,
          "title": "漢字の組み立て / 川をつなぐちえ(1)",
          "kanji": [
            "笛",
            "宮",
            "定",
            "庫",
            "板",
            "階",
            "島",
            "路",
            "荷",
            "県"
          ]
        },
        {
          "number": 3,
          "title": "川をつなぐちえ(2) / 十二支と月のよび名 / 強く心にのこっていることを / 二つの漢字の組み合わせ",
          "kanji": [
            "州",
            "鉄",
            "期",
            "羊",
            "族",
            "配",
            "畑",
            "軽",
            "勝",
            "酒"
          ]
        },
        {
          "number": 4,
          "title": "おにたのぼうし",
          "kanji": [
            "君",
            "福",
            "去",
            "拾",
            "悪",
            "息",
            "波"
          ]
        }
      ]
    }
  ]
}