{
  "grade": 5,
  "series": "あかねこ漢字スキル",
  "publisher": "光村教育図書",
  "textbook": "光村図書 令和2年度版",
  "totalKanji": 193,
  "books": [
    {
      "book": "1学期",
      "lessons": [
        {
          "number": 1,
          "title": "いつか、大切なところ(1)",
          "kanji": [
            "士",
            "混",
            "常",
            "永",
            "慣",
            "状",
            "態",
            "迷",
            "現"
          ]
        },
        {
          "number": 2,
          "title": "いつか、大切なところ(2) / 新聞を読もう / 情報ノート(1)",
          "kanji": [
            "解",
            "編",
            "謝",
            "災",
            "確",
            "情",
            "囲",
            "構",
            "報",
            "容"
          ]
        },
        {
          "number": 3,
          "title": "情報ノート(2) / 漢字学習ノート / 言葉と事実(1)",
          "kanji": [
            "価",
            "識",
            "技",
            "術",
            "非",
            "際",
            "資",
            "快",
            "象",
            "逆"
          ]
        },
        {
          "number": 4,
          "title": "言葉と事実(2) / 話し言葉と書き言葉 / すいせんしよう「町じまん」(1)",
          "kanji": [
            "統",
            "比",
            "像",
            "織",
            "減",
            "職",
            "証",
            "属",
            "応",
            "質"
          ]
        },
        {
          "number": 5,
          "title": "すいせんしよう「町じまん」(2) / 案内やしょうかいのポスター / 漢文に親しむ / 敬語(1)",
          "kanji": [
            "任",
            "故",
            "歴",
            "史",
            "述",
            "経",
            "示",
            "序",
            "勢",
            "精"
          ]
        },
        {
          "number": 6,
          "title": "敬語(2) / 複合語",
          "kanji": [
            "飼",
            "程",
            "貸",
            "許",
            "複",
            "移",
            "責",
            "適",
            "厚"
          ]
        }
      ]
    },
    {
      "book": "2学期",
      "lessons": [
        {
          "number": 1,
          "title": "大造じいさんとがん(1)",
          "kanji": [
            "率",
            "領",
            "夢",
            "喜",
            "険",
            "導",
            "能",
            "略",
            "救",
            "弁"
          ]
        },
        {
          "number": 2,
          "title": "大造じいさんとがん(2) / 鳥 / ミニディベート――AIとのくらし(1)",
          "kanji": [
            "堂",
            "貯",
            "雑",
            "殺",
            "句",
            "得",
            "増",
            "準",
            "備",
            "効"
          ]
        },
        {
          "number": 3,
          "title": "ミニディベート――AIとのくらし(2) / 熟語の構成(1)",
          "kanji": [
            "可",
            "性",
            "評",
            "防",
            "犯",
            "罪",
            "営",
            "造",
            "修",
            "仮"
          ]
        },
        {
          "number": 4,
          "title": "熟語の構成(2)",
          "kanji": [
            "耕",
            "綿",
            "布",
            "損",
            "豊",
            "久",
            "毒"
          ]
        },
        {
          "number": 5,
          "title": "世界遺産 白神山地からの提言――意見文を書こう(1)",
          "kanji": [
            "提",
            "支",
            "採",
            "保",
            "護",
            "河",
            "基",
            "規",
            "制",
            "設"
          ]
        },
        {
          "number": 6,
          "title": "世界遺産 白神山地からの提言――意見文を書こう(2) / 「古典」を楽しむ",
          "kanji": [
            "限",
            "条",
            "件",
            "接",
            "張",
            "師",
            "枝",
            "似",
            "演"
          ]
        },
        {
          "number": 7,
          "title": "かなづかいで気をつけること / 漢字の成り立ち(1)",
          "kanji": [
            "貧",
            "築",
            "政",
            "税",
            "賞",
            "興",
            "因",
            "武",
            "眼",
            "財"
          ]
        },
        {
          "number": 8,
          "title": "漢字の成り立ち(2) / 雪わたり",
          "kanji": [
            "額",
            "紀",
            "燃",
            "粉",
            "断",
            "寄",
            "判",
            "往"
          ]
        }
      ]
    },
    {
      "book": "3学期",
      "lessons": [
        {
          "number": 1,
          "title": "生活をよりよくする提案 / 和語・漢語・外来語(1)",
          "kanji": [
            "衛",
            "過",
            "潔",
            "境",
            "査",
            "航",
            "停",
            "貿",
            "易",
            "婦"
          ]
        },
        {
          "number": 2,
          "title": "和語・漢語・外来語(2) / 同じ音の漢字(1)",
          "kanji": [
            "酸",
            "講",
            "再",
            "旧",
            "績",
            "均",
            "志",
            "測",
            "暴",
            "検"
          ]
        },
        {
          "number": 3,
          "title": "同じ音の漢字(2) / まんがの方法(1)",
          "kanji": [
            "製",
            "復",
            "授",
            "刊",
            "個",
            "破",
            "素",
            "独"
          ]
        },
        {
          "number": 4,
          "title": "まんがの方法(2)",
          "kanji": [
            "益",
            "義",
            "圧",
            "居",
            "型",
            "液",
            "禁"
          ]
        },
        {
          "number": 5,
          "title": "ひみつを調べて発表しよう / 送りがなのきまり(1)",
          "kanji": [
            "賛",
            "絶",
            "告",
            "総",
            "桜",
            "仏",
            "妻",
            "舎",
            "鉱",
            "銅"
          ]
        },
        {
          "number": 6,
          "title": "送りがなのきまり(2) / みすゞさがしの旅――みんなちがって、みんないい(1)",
          "kanji": [
            "脈",
            "輸",
            "則",
            "肥",
            "版",
            "留",
            "墓",
            "幹",
            "団",
            "務"
          ]
        },
        {
          "number": 7,
          "title": "みすゞさがしの旅――みんなちがって、みんないい(2)",
          "kanji": [
            "祖",
            "在",
            "費",
            "余",
            "招",
            "格"
          ]
        }
      ]
    }
  ]
}