{
  "grade": 2,
  "series": "あかねこ漢字スキル",
  "publisher": "光村教育図書",
  "textbook": "光村図書 令和2年度版",
  "totalKanji": 160,
  "books": [
    {
      "book": "1学期",
      "lessons": [
        {
          "number": 1,
          "title": "つづけて みよう――日記(1)",
          "kanji": [
            "曜",
            "書",
            "記",
            "活",
            "朝"
          ]
        },
        {
          "number": 2,
          "title": "つづけて みよう――日記(2)",
          "kanji": [
            "思",
            "友",
            "通",
            "色",
            "今"
          ]
        },
        {
          "number": 3,
          "title": "はるねこ(2) / ひろい 公園(1)",
          "kanji": [
            "聞",
            "読",
            "声",
            "話",
            "公",
            "何",
            "園",
            "言"
          ]
        },
        {
          "number": 4,
          "title": "ひろい 公園(2) / 回文を たのしもう / 画と 書きじゅん(1)",
          "kanji": [
            "線",
            "回",
            "汽",
            "画",
            "星",
            "会",
            "同"
          ]
        },
        {
          "number": 5,
          "title": "画と 書きじゅん(2) / すみれと あり(1)",
          "kanji": [
            "春",
            "方",
            "数",
            "道",
            "工",
            "点",
            "羽",
            "馬"
          ]
        },
        {
          "number": 6,
          "title": "すみれと あり(2) / かんさつ発見カード",
          "kanji": [
            "形",
            "自",
            "高",
            "黄",
            "分",
            "近",
            "外",
            "地"
          ]
        },
        {
          "number": 7,
          "title": "かたかなで 書く 言葉 / 本で しらべよう / 「生きものクイズ」で しらせよう",
          "kanji": [
            "間",
            "図",
            "国",
            "答",
            "作",
            "前",
            "週",
            "絵"
          ]
        },
        {
          "number": 8,
          "title": "なかまの 言葉と 漢字(1)",
          "kanji": [
            "姉",
            "兄",
            "昼",
            "父",
            "夜",
            "母",
            "親"
          ]
        },
        {
          "number": 9,
          "title": "なかまの 言葉と 漢字(2) / 「言葉のなかまさがしゲーム」を しよう",
          "kanji": [
            "内",
            "語",
            "弟",
            "夏",
            "算",
            "妹",
            "海",
            "万"
          ]
        },
        {
          "number": 10,
          "title": "きつねの おきゃくさま(1)",
          "kanji": [
            "心",
            "考",
            "切",
            "太",
            "行",
            "丸"
          ]
        },
        {
          "number": 11,
          "title": "きつねの おきゃくさま(2) / うれしく なる 言葉",
          "kanji": [
            "合",
            "場",
            "楽",
            "時",
            "元",
            "才"
          ]
        }
      ]
    },
    {
      "book": "2学期",
      "lessons": [
        {
          "number": 1,
          "title": "二つの漢字でできている言葉(1) / 夏休みのこと / 話したいな、聞きたいな、",
          "kanji": [
            "鳥",
            "組",
            "新",
            "市",
            "牛",
            "弓"
          ]
        },
        {
          "number": 2,
          "title": "二つの漢字でできている言葉(2)",
          "kanji": [
            "古",
            "毛",
            "門",
            "電",
            "光",
            "矢"
          ]
        },
        {
          "number": 3,
          "title": "わにのおじいさんのたからもの(1)",
          "kanji": [
            "紙",
            "半",
            "頭",
            "谷",
            "長",
            "野",
            "顔",
            "体"
          ]
        },
        {
          "number": 4,
          "title": "わにのおじいさんのたからもの(2) / はんたいの意味の言葉、にている意味の言葉 / 町の「すてき」をつたえます",
          "kanji": [
            "理",
            "細",
            "岩",
            "知",
            "科",
            "強",
            "室",
            "弱"
          ]
        },
        {
          "number": 5,
          "title": "さけが大きくなるまで(1)",
          "kanji": [
            "帰",
            "冬",
            "北",
            "東",
            "広",
            "魚",
            "食",
            "秋"
          ]
        },
        {
          "number": 6,
          "title": "さけが大きくなるまで(2) / おもしろいもの、見つけたよ / ないた赤おに(1)",
          "kanji": [
            "戸",
            "家",
            "西",
            "首",
            "角",
            "南",
            "当",
            "少"
          ]
        },
        {
          "number": 7,
          "title": "ないた赤おに(2) / 「お話びじゅつかん」を作ろう / 「クラスお楽しみ会」をひらこう",
          "kanji": [
            "交",
            "遠",
            "茶",
            "多",
            "後",
            "引",
            "教",
            "毎"
          ]
        },
        {
          "number": 8,
          "title": "漢字のつかい方と読み方 / ジャンプロケットを作ろう",
          "kanji": [
            "船",
            "売",
            "晴",
            "台",
            "計",
            "社",
            "肉",
            "歩"
          ]
        }
      ]
    },
    {
      "book": "3学期",
      "lessons": [
        {
          "number": 1,
          "title": "かさこじぞう(1)",
          "kanji": [
            "米",
            "来",
            "買",
            "歌",
            "風",
            "店",
            "雪",
            "原"
          ]
        },
        {
          "number": 2,
          "title": "かさこじぞう(2) / かるたであそぼう / 主語とじゅつ語",
          "kanji": [
            "番",
            "寺",
            "止",
            "雲",
            "麦",
            "池",
            "京",
            "里"
          ]
        },
        {
          "number": 3,
          "title": "こんなことができるようになったよ / 音や様子をあらわす言葉 / 組み合わせてできている漢字 / アレクサンダとぜんまいねずみ",
          "kanji": [
            "午",
            "鳴",
            "走",
            "黒",
            "明",
            "直",
            "刀",
            "用"
          ]
        }
      ]
    }
  ]
}